{
  "catalogVersion": "0.1.0-draft",
  "scenario": {
    "name": "MEM-DEMO-A0 design-to-fab lifecycle",
    "productId": "MEM-DEMO-A0",
    "designVersion": "rtl-v0.3",
    "lotId": "LOT-DEMO-0903",
    "equipmentId": "ETCH-DEMO-01"
  },
  "disclaimer": "All code, measurements, equipment identifiers, operating ranges, and documents are synthetic demonstration data. No skill executes EDA software, changes equipment settings, or authorizes production use.",
  "skills": [
    {
      "id": 1,
      "slug": "ax-engineering-handoff-summary",
      "name": "엔지니어링 인계 요약",
      "domain": "AX",
      "category": "FRONTEND",
      "lifecycleStage": "KNOWLEDGE_TRANSFER",
      "skillType": "STRUCTURED",
      "riskLevel": "LOW",
      "version": "1.0.0-draft",
      "status": "DRAFT",
      "shortDescription": "설계·검증·공정·장비 팀 사이의 인계 내용을 미결 사항과 다음 행동으로 정리합니다.",
      "useWhen": "한 팀의 작업 결과를 다음 팀이 이어받기 전에 핵심 변경점과 미해결 위험을 빠르게 확인해야 할 때",
      "instructions": [
        "확인된 사실과 추정 사항을 분리한다.",
        "미결 사항마다 담당자와 다음 확인 시점을 붙인다.",
        "원문에 없는 완료 상태를 만들어내지 않는다."
      ],
      "requiredInputs": ["fromTeam", "toTeam", "productId", "handoffNotes"],
      "outputFields": ["summary", "completedItems", "openIssues", "nextActions"],
      "demoInput": {
        "fromTeam": "RTL Design",
        "toTeam": "Verification",
        "productId": "MEM-DEMO-A0",
        "handoffNotes": [
          "reset polarity mismatch fixed in demo commit 31",
          "CDC waiver W-07 is still pending",
          "regression 118 of 120 tests passed"
        ]
      },
      "demoOutput": {
        "summary": "RTL 수정본이 검증팀으로 인계되었으며 CDC 예외 1건과 회귀 테스트 2건이 남아 있습니다.",
        "completedItems": ["reset polarity mismatch 수정"],
        "openIssues": ["CDC waiver W-07 미승인", "회귀 테스트 2건 실패"],
        "nextActions": ["검증팀이 실패 테스트 로그 확인", "설계 리드가 W-07 승인 여부 결정"]
      },
      "successCriteria": ["완료·미완료 항목이 구분됨", "다음 담당팀이 바로 행동할 수 있음"],
      "limitations": ["원문에 없는 일정이나 승인 결과를 추정하지 않음"],
      "relatedSkills": ["ax-weekly-risk-report", "fabless-tapeout-readiness"],
      "compatibleTargets": ["OPENAI", "ANTHROPIC", "GEMINI", "OLLAMA"],
      "authorName": "SKALA Semiconductor AX Team",
      "usageCount": 214
    },
    {
      "id": 2,
      "slug": "ax-design-equipment-document-explainer",
      "name": "설계도·장비 설명서 이해 도우미",
      "domain": "CROSS_DOMAIN",
      "category": "OTHER",
      "lifecycleStage": "KNOWLEDGE_TRANSFER",
      "skillType": "STRUCTURED",
      "riskLevel": "MEDIUM",
      "version": "1.0.0-draft",
      "status": "DRAFT",
      "shortDescription": "인계받은 블록 설계도와 장비 사용설명서의 구성·순서·주의사항을 초보자 관점으로 풀이합니다.",
      "useWhen": "새 담당자가 회로 블록도, 인터페이스 문서 또는 장비 매뉴얼을 처음 읽고 질문 목록을 만들어야 할 때",
      "instructions": [
        "문서에 적힌 구성요소와 연결만 설명하고 누락된 사양은 질문으로 남긴다.",
        "경고·인터록·승인 절차는 요약에서 제외하지 않는다.",
        "설계 설명과 실제 장비 조작 지시를 구분한다."
      ],
      "requiredInputs": ["documentType", "documentExcerpt", "readerRole"],
      "outputFields": ["plainSummary", "components", "sequence", "warnings", "questions"],
      "demoInput": {
        "documentType": "equipment_manual_excerpt",
        "readerRole": "new equipment engineer",
        "documentExcerpt": "Load lock must reach READY before transfer. Interlock I-12 blocks chamber motion when vacuum status is UNKNOWN."
      },
      "demoOutput": {
        "plainSummary": "로드락 준비와 진공 상태 확인이 끝나야 챔버 이송이 가능합니다.",
        "components": ["load lock", "transfer chamber", "interlock I-12"],
        "sequence": ["load lock READY 확인", "vacuum 상태 확인", "transfer 허용 여부 확인"],
        "warnings": ["vacuum이 UNKNOWN이면 I-12가 동작을 차단함"],
        "questions": ["READY 판정 기준값은 어느 절에 정의되어 있는가?"]
      },
      "successCriteria": ["구성·순서·경고·질문이 분리됨", "원문 근거 밖의 조작법을 생성하지 않음"],
      "limitations": ["전체 매뉴얼 검토나 현장 교육을 대체하지 않음", "장비 제어 명령을 생성하지 않음"],
      "relatedSkills": ["foundry-equipment-handover", "foundry-startup-verification", "visual-equipment-render-brief"],
      "compatibleTargets": ["OPENAI", "ANTHROPIC", "GEMINI", "OLLAMA"],
      "authorName": "SKALA Semiconductor AX Team",
      "usageCount": 176
    },
    {
      "id": 3,
      "slug": "ax-weekly-risk-report",
      "name": "반도체 개발 주간 리스크 보고서",
      "domain": "AX",
      "category": "FRONTEND",
      "lifecycleStage": "REPORTING",
      "skillType": "PROMPT",
      "riskLevel": "LOW",
      "version": "1.0.0-draft",
      "status": "DRAFT",
      "shortDescription": "설계부터 생산까지의 사실을 성과·위험·담당자·다음 계획 형식으로 압축합니다.",
      "useWhen": "여러 팀에서 전달된 상태 정보를 경영진 또는 프로젝트 리드용 주간 보고로 합칠 때",
      "instructions": [
        "정량 수치는 입력에 있는 값만 사용한다.",
        "위험마다 영향 범위와 담당자를 표시한다.",
        "기술 세부사항은 의사결정에 필요한 수준으로 축약한다."
      ],
      "requiredInputs": ["reportingPeriod", "facts", "owners"],
      "outputFields": ["achievements", "risks", "decisionsNeeded", "nextWeek"],
      "demoInput": {
        "reportingPeriod": "Demo Week 1",
        "facts": [
          "RTL regression 118/120 passed",
          "timing signoff blocked by -0.18 ns setup slack",
          "ETCH-DEMO-01 startup verification pending"
        ],
        "owners": ["RTL: 김설계", "Timing: 이검증", "Equipment: 박장비"]
      },
      "demoOutput": {
        "achievements": ["RTL 회귀 테스트 120건 중 118건 통과"],
        "risks": ["setup slack -0.18 ns로 signoff 차단", "장비 기동 확인 미완료"],
        "decisionsNeeded": ["타이밍 수정안의 파이프라인 변경 승인 여부"],
        "nextWeek": ["실패 테스트 2건 재현", "장비 기동 체크리스트 완료"]
      },
      "successCriteria": ["성과와 위험이 섞이지 않음", "각 위험의 담당자를 역추적할 수 있음"],
      "limitations": ["프로젝트 상태 시스템의 원본 데이터를 수정하지 않음"],
      "relatedSkills": ["ax-engineering-handoff-summary", "visual-workflow-figure"],
      "compatibleTargets": ["OPENAI", "ANTHROPIC", "GEMINI", "OLLAMA"],
      "authorName": "SKALA Semiconductor AX Team",
      "usageCount": 331
    },
    {
      "id": 4,
      "slug": "fabless-systemverilog-rtl-review",
      "name": "SystemVerilog RTL 기본 리뷰",
      "domain": "FABLESS",
      "category": "BACKEND",
      "lifecycleStage": "DESIGN",
      "skillType": "DIAGNOSTIC",
      "riskLevel": "MEDIUM",
      "version": "1.0.0-draft",
      "status": "DRAFT",
      "shortDescription": "합성 가능한 RTL에서 기본 코딩 위험과 수정 후보를 줄 단위로 검토합니다.",
      "useWhen": "RTL 작성 또는 변경 직후 정식 lint·simulation 전에 빠른 정적 리뷰가 필요할 때",
      "instructions": [
        "각 지적에 코드 줄과 적용 규칙을 붙인다.",
        "확인하지 못한 합성·타이밍 통과를 주장하지 않는다.",
        "기능 요구사항이 없으면 기능 의도를 단정하지 않는다."
      ],
      "requiredInputs": ["language", "rtlCode", "clockResetConvention"],
      "outputFields": ["severity", "line", "rule", "explanation", "suggestedFix"],
      "demoInput": {
        "language": "SystemVerilog",
        "clockResetConvention": "posedge clock, nonblocking sequential assignment",
        "rtlCode": "always_ff @(posedge clk) begin\n  if (en) q = d;\nend"
      },
      "demoOutput": {
        "issues": [
          {
            "severity": "HIGH",
            "line": 2,
            "rule": "sequential-nonblocking-assignment",
            "explanation": "always_ff 블록에서 blocking assignment가 사용되었습니다.",
            "suggestedFix": "q <= d; 로 변경하고 시뮬레이션으로 동작을 재확인합니다."
          }
        ]
      },
      "successCriteria": ["지적이 코드 위치와 연결됨", "수정 후 재검증 항목을 제시함"],
      "limitations": ["lint·simulation·formal verification을 실제 실행하지 않음"],
      "relatedSkills": ["fabless-hdl-refactor", "fabless-testbench-scenario", "fabless-simulation-debug"],
      "compatibleTargets": ["OPENAI", "ANTHROPIC", "GEMINI", "OLLAMA"],
      "authorName": "SKALA Semiconductor AX Team",
      "usageCount": 487
    },
    {
      "id": 5,
      "slug": "fabless-hdl-refactor",
      "name": "기능 보존 HDL 리팩토링",
      "domain": "FABLESS",
      "category": "BACKEND",
      "lifecycleStage": "DESIGN",
      "skillType": "CODE_TRANSFORM",
      "riskLevel": "MEDIUM",
      "version": "1.0.0-draft",
      "status": "DRAFT",
      "shortDescription": "인터페이스·지연·리셋 의미를 보존하면서 중복되거나 읽기 어려운 HDL을 정리합니다.",
      "useWhen": "RTL의 가독성이나 재사용성을 높여야 하지만 외부 동작 계약은 바꾸면 안 될 때",
      "instructions": [
        "입출력 포트와 클럭 지연을 변경하지 않는다.",
        "변경 전후 동치 확인 항목을 함께 만든다.",
        "성능 개선을 주장하려면 별도의 합성 결과가 필요하다고 표시한다."
      ],
      "requiredInputs": ["rtlCode", "invariants", "styleGuide"],
      "outputFields": ["refactoredCode", "changes", "preservedInvariants", "verificationChecklist"],
      "demoInput": {
        "rtlCode": "always_comb begin\n  y = 1'b0;\n  if (en) begin\n    if (sel) y = a; else y = b;\n  end\nend",
        "invariants": ["combinational output", "same port list", "no added latency"],
        "styleGuide": "prefer concise combinational expressions"
      },
      "demoOutput": {
        "refactoredCode": "assign y = en ? (sel ? a : b) : 1'b0;",
        "changes": ["중첩 조건을 단일 조건식으로 정리"],
        "preservedInvariants": ["포트 유지", "조합 논리 유지", "지연 추가 없음"],
        "verificationChecklist": ["truth table 비교", "lint 실행", "기존 테스트벤치 회귀 실행"]
      },
      "successCriteria": ["변경 불가 조건이 명시됨", "동치 검증 체크리스트가 포함됨"],
      "limitations": ["실제 논리 동치 검증과 합성을 수행하지 않음"],
      "relatedSkills": ["fabless-systemverilog-rtl-review", "fabless-clock-cycle-trace", "fabless-testbench-scenario"],
      "compatibleTargets": ["OPENAI", "ANTHROPIC", "GEMINI", "OLLAMA"],
      "authorName": "SKALA Semiconductor AX Team",
      "usageCount": 302
    },
    {
      "id": 6,
      "slug": "fabless-clock-cycle-trace",
      "name": "RTL 클럭 단위 상태 추적",
      "domain": "FABLESS",
      "category": "DATA_SCIENCE",
      "lifecycleStage": "VERIFICATION",
      "skillType": "STRUCTURED",
      "riskLevel": "MEDIUM",
      "version": "1.0.0-draft",
      "status": "DRAFT",
      "shortDescription": "초기 상태와 입력 자극을 바탕으로 레지스터 값을 클럭 에지별 표로 추적합니다.",
      "useWhen": "nonblocking assignment, enable, reset 때문에 특정 사이클의 상태 변화를 사람이 확인해야 할 때",
      "instructions": [
        "샘플링 시점과 업데이트 시점을 구분한다.",
        "알 수 없는 초기값은 임의로 0으로 두지 않는다.",
        "동시 이벤트의 우선순위는 제공된 RTL을 따른다."
      ],
      "requiredInputs": ["rtlFragment", "initialState", "clockEdgesNs", "stimulus"],